{
  "domain": {
    "name": "Blockchain and Cryptocurrency",
    "description": "The blockchain and cryptocurrency landscape, encompassing Layer 1 and Layer 2 blockchains, decentralized finance protocols, centralized and decentralized exchanges, NFT marketplaces, infrastructure providers, stablecoins, wallets, privacy technologies, and institutional platforms competing to define the future of decentralized digital finance and Web3.",
    "placeholders": {
      "domain_term": "blockchain and crypto",
      "entity_term": "project",
      "category_term": "category"
    }
  },
  "entity_master_list": [
    { "entity_id": "E001", "label": "Bitcoin" },
    { "entity_id": "E002", "label": "Ethereum" },
    { "entity_id": "E003", "label": "Solana" },
    { "entity_id": "E004", "label": "Cardano" },
    { "entity_id": "E005", "label": "Avalanche" },
    { "entity_id": "E006", "label": "Polkadot" },
    { "entity_id": "E007", "label": "Near Protocol" },
    { "entity_id": "E008", "label": "Sui" },
    { "entity_id": "E009", "label": "Aptos" },
    { "entity_id": "E010", "label": "Cosmos" },
    { "entity_id": "E011", "label": "Algorand" },
    { "entity_id": "E012", "label": "TON" },
    { "entity_id": "E013", "label": "Hedera" },
    { "entity_id": "E014", "label": "Fantom (Sonic)" },
    { "entity_id": "E015", "label": "Tezos" },
    { "entity_id": "E016", "label": "Polygon" },
    { "entity_id": "E017", "label": "Arbitrum" },
    { "entity_id": "E018", "label": "Optimism" },
    { "entity_id": "E019", "label": "zkSync" },
    { "entity_id": "E020", "label": "StarkNet" },
    { "entity_id": "E021", "label": "Base" },
    { "entity_id": "E022", "label": "Scroll" },
    { "entity_id": "E023", "label": "Mantle" },
    { "entity_id": "E024", "label": "Blast" },
    { "entity_id": "E025", "label": "Linea" },
    { "entity_id": "E026", "label": "Uniswap" },
    { "entity_id": "E027", "label": "Aave" },
    { "entity_id": "E028", "label": "MakerDAO (Sky)" },
    { "entity_id": "E029", "label": "Lido" },
    { "entity_id": "E030", "label": "Curve Finance" },
    { "entity_id": "E031", "label": "Compound" },
    { "entity_id": "E032", "label": "dYdX" },
    { "entity_id": "E033", "label": "GMX" },
    { "entity_id": "E034", "label": "Jupiter" },
    { "entity_id": "E035", "label": "Raydium" },
    { "entity_id": "E036", "label": "1inch" },
    { "entity_id": "E037", "label": "Yearn Finance" },
    { "entity_id": "E038", "label": "Pendle" },
    { "entity_id": "E039", "label": "Synthetix" },
    { "entity_id": "E040", "label": "Convex Finance" },
    { "entity_id": "E041", "label": "EigenLayer" },
    { "entity_id": "E042", "label": "Coinbase" },
    { "entity_id": "E043", "label": "Binance" },
    { "entity_id": "E044", "label": "Kraken" },
    { "entity_id": "E045", "label": "OKX" },
    { "entity_id": "E046", "label": "Bybit" },
    { "entity_id": "E047", "label": "Gemini" },
    { "entity_id": "E048", "label": "Crypto.com" },
    { "entity_id": "E049", "label": "KuCoin" },
    { "entity_id": "E050", "label": "Bitfinex" },
    { "entity_id": "E051", "label": "Robinhood Crypto" },
    { "entity_id": "E052", "label": "OpenSea" },
    { "entity_id": "E053", "label": "Blur" },
    { "entity_id": "E054", "label": "Magic Eden" },
    { "entity_id": "E055", "label": "Axie Infinity" },
    { "entity_id": "E056", "label": "Immutable X" },
    { "entity_id": "E057", "label": "The Sandbox" },
    { "entity_id": "E058", "label": "Decentraland" },
    { "entity_id": "E059", "label": "Chainlink" },
    { "entity_id": "E060", "label": "The Graph" },
    { "entity_id": "E061", "label": "Filecoin" },
    { "entity_id": "E062", "label": "Arweave" },
    { "entity_id": "E063", "label": "Helium" },
    { "entity_id": "E064", "label": "Render Network" },
    { "entity_id": "E065", "label": "Tether (USDT)" },
    { "entity_id": "E066", "label": "Circle (USDC)" },
    { "entity_id": "E067", "label": "MetaMask" },
    { "entity_id": "E068", "label": "Phantom" },
    { "entity_id": "E069", "label": "Ledger" },
    { "entity_id": "E070", "label": "Trezor" },
    { "entity_id": "E071", "label": "Wormhole" },
    { "entity_id": "E072", "label": "LayerZero" },
    { "entity_id": "E073", "label": "Monero" },
    { "entity_id": "E074", "label": "Zcash" },
    { "entity_id": "E075", "label": "Chainalysis" },
    { "entity_id": "E076", "label": "Nansen" },
    { "entity_id": "E077", "label": "Dune Analytics" },
    { "entity_id": "E078", "label": "Ripple (XRP)" },
    { "entity_id": "E079", "label": "Litecoin" },
    { "entity_id": "E080", "label": "Dogecoin" },
    { "entity_id": "E081", "label": "Shiba Inu" },
    { "entity_id": "E082", "label": "Worldcoin" },
    { "entity_id": "E083", "label": "Celestia" },
    { "entity_id": "E084", "label": "Hyperliquid" },
    { "entity_id": "E085", "label": "Pyth Network" },
    { "entity_id": "E086", "label": "Ondo Finance" },
    { "entity_id": "E087", "label": "Ethena" },
    { "entity_id": "E088", "label": "Jito" },
    { "entity_id": "E089", "label": "Safe (Gnosis Safe)" },
    { "entity_id": "E090", "label": "Fireblocks" }
  ],
  "category_labels": [
    { "category_id": "C01", "label": "Layer 1 Blockchains" },
    { "category_id": "C02", "label": "Layer 2 / Scaling Solutions" },
    { "category_id": "C03", "label": "Decentralized Exchanges (DEX)" },
    { "category_id": "C04", "label": "Lending / Borrowing Protocols" },
    { "category_id": "C05", "label": "Liquid Staking / Restaking" },
    { "category_id": "C06", "label": "Yield Optimization" },
    { "category_id": "C07", "label": "Derivatives / Perpetuals" },
    { "category_id": "C08", "label": "Stablecoins / Stablecoin Issuers" },
    { "category_id": "C09", "label": "Centralized Exchanges (CEX)" },
    { "category_id": "C10", "label": "NFT Marketplaces" },
    { "category_id": "C11", "label": "Gaming / Metaverse" },
    { "category_id": "C12", "label": "Infrastructure / Oracles" },
    { "category_id": "C13", "label": "Data / Analytics" },
    { "category_id": "C14", "label": "Decentralized Storage" },
    { "category_id": "C15", "label": "Privacy Coins / Privacy Tech" },
    { "category_id": "C16", "label": "Cross-Chain / Interoperability" },
    { "category_id": "C17", "label": "Wallets / Key Management" },
    { "category_id": "C18", "label": "Institutional / Custody" },
    { "category_id": "C19", "label": "DePIN (Decentralized Physical Infrastructure)" },
    { "category_id": "C20", "label": "Memecoins" },
    { "category_id": "C21", "label": "Real-World Assets (RWA)" },
    { "category_id": "C22", "label": "Modular Blockchains" },
    { "category_id": "C23", "label": "Zero-Knowledge Technology" },
    { "category_id": "C24", "label": "Payments / Remittances" },
    { "category_id": "C25", "label": "Regulatory-Compliant / Licensed" },
    { "category_id": "C26", "label": "DAO / Governance" },
    { "category_id": "C27", "label": "Consumer / Social" }
  ],
  "category_pairs": [
    { "pair_id": "P01", "category_a_id": "C01", "category_b_id": "C02" },
    { "pair_id": "P02", "category_a_id": "C01", "category_b_id": "C22" },
    { "pair_id": "P03", "category_a_id": "C02", "category_b_id": "C23" },
    { "pair_id": "P04", "category_a_id": "C03", "category_b_id": "C07" },
    { "pair_id": "P05", "category_a_id": "C04", "category_b_id": "C05" },
    { "pair_id": "P06", "category_a_id": "C04", "category_b_id": "C06" },
    { "pair_id": "P07", "category_a_id": "C05", "category_b_id": "C06" },
    { "pair_id": "P08", "category_a_id": "C08", "category_b_id": "C24" },
    { "pair_id": "P09", "category_a_id": "C09", "category_b_id": "C25" },
    { "pair_id": "P10", "category_a_id": "C09", "category_b_id": "C18" },
    { "pair_id": "P11", "category_a_id": "C10", "category_b_id": "C11" },
    { "pair_id": "P12", "category_a_id": "C12", "category_b_id": "C14" },
    { "pair_id": "P13", "category_a_id": "C12", "category_b_id": "C16" },
    { "pair_id": "P14", "category_a_id": "C15", "category_b_id": "C01" },
    { "pair_id": "P15", "category_a_id": "C19", "category_b_id": "C14" },
    { "pair_id": "P16", "category_a_id": "C20", "category_b_id": "C27" },
    { "pair_id": "P17", "category_a_id": "C21", "category_b_id": "C08" },
    { "pair_id": "P18", "category_a_id": "C17", "category_b_id": "C18" }
  ],
  "micro_monopoly_candidates": [
    { "entity_id": "E001", "candidate_category_ids": ["C01", "C24", "C25"] },
    { "entity_id": "E002", "candidate_category_ids": ["C01", "C02", "C26"] },
    { "entity_id": "E003", "candidate_category_ids": ["C01", "C03", "C27"] },
    { "entity_id": "E016", "candidate_category_ids": ["C02", "C23", "C01"] },
    { "entity_id": "E017", "candidate_category_ids": ["C02", "C03", "C23"] },
    { "entity_id": "E026", "candidate_category_ids": ["C03", "C26", "C02"] },
    { "entity_id": "E027", "candidate_category_ids": ["C04", "C03", "C26"] },
    { "entity_id": "E028", "candidate_category_ids": ["C04", "C08", "C26"] },
    { "entity_id": "E029", "candidate_category_ids": ["C05", "C06", "C26"] },
    { "entity_id": "E042", "candidate_category_ids": ["C09", "C25", "C18"] },
    { "entity_id": "E043", "candidate_category_ids": ["C09", "C03", "C25"] },
    { "entity_id": "E052", "candidate_category_ids": ["C10", "C27", "C11"] },
    { "entity_id": "E059", "candidate_category_ids": ["C12", "C16", "C21"] },
    { "entity_id": "E065", "candidate_category_ids": ["C08", "C24", "C25"] },
    { "entity_id": "E073", "candidate_category_ids": ["C15", "C01", "C24"] },
    { "entity_id": "E041", "candidate_category_ids": ["C05", "C12", "C22"] },
    { "entity_id": "E083", "candidate_category_ids": ["C22", "C01", "C12"] },
    { "entity_id": "E084", "candidate_category_ids": ["C07", "C03", "C09"] },
    { "entity_id": "E086", "candidate_category_ids": ["C21", "C08", "C04"] },
    { "entity_id": "E067", "candidate_category_ids": ["C17", "C27", "C09"] }
  ],
  "entity_blocks": [
    {
      "block_id": "B1",
      "entity_ids": [